,ENTIDAD,OBJETIVO,IMPORTE,AÑO
271,ÁREA DE MOVILIDAD Y SOSTENIBILIDAD,Convenio Colaboración Fomento de Empleo 2018,-   €,2018
272,"ÁREA DE OBRAS, SERVICIOS, REHABILITACIÓN URBANA Y SERVICIO PÚBLICO",Convenio Colaboración Fomento de Empleo 2018,-   €,2018
273,ÁREA DE PLANIFICACIÓN URBANA,Convenio Colaboración Fomento de Empleo 2018,-   €,2018
274,ÁREA DE SALUD Y CONSUMO,Convenio Colaboración Fomento de Empleo 2018,-   €,2018
275,ÁREA DE SEGURIDAD CIUDADANA,Convenio Colaboración Fomento de Empleo 2018,-   €,2018
276,ÁREA DE ECONOMÍA Y HACIENDA,Convenio Colaboración Fomento de Empleo 2018,-   €,2018
277,AREA DE ACCION SOCIAL,Convenio Colaboración Fomento de Empleo 2018,-   €,2018
278,ATHLETIC CLUB,Adhesión BICB,-,2017
279,LEONARDO ALFREDO POLLAVINI,Eurocip VII,"8.142,00 €",2017
280,AKADEMIE ÜBERLINGEN VERWALTUNGS-GMBH,Eurocip VII,"13.276,00 €",2017
281,BERUFSBILDUNGSZENTRUM AUGSBURG DER LEHMBAUGRUPPE GGMBH (BBZ),Eurocip VII,"7.436,00 €",2017
282,BERUFSBILDUNGSZENTRUM AUGSBURG DER LEHMBAUGRUPPE GGMBH (BBZ),Eurocip VII,"13.276,00 €",2017
283,"SHINE IBERIA, SL",Colaboración para la producción de un programa para TVE,"27.453,80 €",2017
284,ASOCIACIÓN DESTINOS EUSKADI,Plan anual Destinos Euskadi 2017,"12.947,00 €",2017
285,"HP PRINTING AND COMPUTING SOLUTIONS, SLU",Colaboración actividades Centro Big Bilbao (Centro Colón),-,2017
286,FEDERACIÓN VASCA DE BALONCESTO Y FEDERACIÓN VIZCAÍNA DE BALONCESTO,Fase final Basket Junior,"75.000,00 €",2017
287,UNIVERSIDAD DEL PAIS VASCO / EUSKAL HERRIKO UNIBERTSITATEA - MUSEO MARITIMO RÍA DE BILBAO - AURTENETXEA,,,2017
288,"CONTAINERS, SA",Intervenciones artísticas Bilbao Art District,"1.500,00 €",2017
289,MONDRAGON UNIBERTSITATEA,Colaboración actividades Centro Big Bilbao (Centro Colón),-,2017
290,"CÁMARA DE COMERCIO, INDUSTRIA Y NAVEGACIÓN DE BILBAO",Colaboración actividades Centro Big Bilbao (Centro Colón),-,2017
291,UNIVERSIDAD DE LA IGLESIA DE DEUSTO,Colaboración actividades Centro Big Bilbao (Centro Colón),-,2017
292,"BEAZ, SAU E INNOBASQUE",Economía Circular,-,2017
293,"BEAZ, SAU",Kbi digital,-,2017
294,DIPUTACION FORAL DE BIZKAIA,Bilbao Bizkaia Film Commission BBFC,-,2017
295,ASOCIACIÓN PARA LA PROMOCIÓN DE LOS BARRIOS HISTÓRICOS DE BILBAO - BILBAOHISTORIKO ELKARTEA,Cesión ExpoGela,-,2017
296,"CD BASKET BILBAO BERRI, SAD",Cesión Bilbao Arena,-,2017
297,"PEÑASCAL, S.COOP.",Prórroga Convenio uso instalaciones Montaño (160611/Col.),-,2017
298,ESCUELA PROFESIONAL DE OTXARKOAGA,Colaboración uso instalaciones del Centro Darío de Areitio,-,2017
299,"MIK, S.COOP.",Colaboración Congreso RESER 2017,-,2017
300,"MICROSOFT IBÉRICA, SRL",Colaboración actividades Centro Big Bilbao (Centro Colón),-,2017
301,"KUTXABANK, SA",Colaboración actividades Centro Big Bilbao (Centro Colón),-,2017
302,"TELEFONICA DE ESPAÑA, SAU",Colaboración actividades Centro Big Bilbao (Centro Colón),-,2017
303,OAL VIVIENDAS MUNICIPALES DE BILBAO,Adenda al Convenio de Colaboración 150220/Col. (Prom. actividades empresariales lonjas VVMM),-,2017
304,ASOCIACIÓN CULTURAL ESPACIO PLAZA SAREAN KULTUR ELKARTEA,Dinamización Sarean,-,2017
305,UNIVERSIDAD DEL PAIS VASCO / EUSKAL HERRIKO UNIBERTSITATEA,Intervenciones artísticas UPV - Facultad Bellas Artes - Bilbao Art District,"1.650,00 €",2017
306,"GRUPO SERVICIOS SOCIALES INTEGRADOS, S.COOP.",Colaboración actividades Centro Big Bilbao (Centro Colón),-,2017
307,ELHUYAR FUNDAZIOA,Centro de red Bizilabe,"80.000,00 €",2017
308,DIPUTACION FORAL DE BIZKAIA,Comercialización y gestión de la tarjeta turística Bilbao Bizkaia Card,-,2017
309,FUNDACIÓN OTXARKI Y MERCEDARIAS MISIONERAS DE BERRIZ,Colaboración en la puesta en marcha del Proyecto Otxarki - Colegio Veracruz 2017-2021,"450.000,00 €",2017
310,"CRIMEN ZINEMA, AIE","Rodaje película ""Ola de crímenes"" (Actividades Bilbao Bizkaia Film Commission)",-,2017
311,COLEGIO DE DECORADORES Y DISEÑADORES DE BIZKAIA,BiziaGo 2017,"21.860,71 €",2017
312,FUNDACION ITAKA ESCOLAPIOS,Programa Ojalá,"17.000,00 €",2017
313,FUNDACION ADSIS,Eurocip VIII,-,2017
314,ESCUELA PROFESIONAL DE OTXARKOAGA,Eurocip VIII,-,2017
315,"PEÑASCAL, S.COOP.",Eurocip VIII,-,2017
316,UNIVERSIDAD DE LA IGLESIA DE DEUSTO,Technoshop 2017,"35.000,00 €",2017
317,MTV NETWORKS EUROPE,Colaboración MTV Awards 2018,"3.000.000,00 €",2017
318,"ADMINISTRACIÓN DE LA COMUNIDAD AUTÓNOMA DEL PAÍS VASCO, AYUNTAMIENTO DE BILBAO, CAMARA DE COMERCIO",,,2017
319,INDUSTRIA Y NAVEGACIÓN DE BILBAO Y PLATAFORMA PÚBLICO-PRIVADA PARA LA PROMOCIÓN DE LA ACTIVIDAD,Gerentes de centros comerciales urbanos,"90.000,00 €",2017
320,COMERCIALY TURÍSTICA DE BILBAO - BILBAO DENDAK,,,2017
321,LANBIDE - SERVICIO VASCO DE EMPLEO,Colaboración convocatoria ayudas emprendedores 2017,-,2017
322,ASOCIACIÓN DE APOYO AL DESARROLLO EMPRESARIAL DEMA-ENPRESA GARAPENA DE BARAKALDO,Lanzaderas de empleo y empleo solidario - Anezka Bilbao,-,2016
323,FUNDACION ITAKA ESCOLAPIOS,Colaboración Fundación Itaka,"17.000,00 €",2016
324,UNIVERSIDAD DEL PAIS VASCO / EUSKAL HERRIKO UNIBERTSITATEA - FUNDACIÓN BILBAO ARTE FUNDAZIOA,Arteshop 2016,-,2016
325,ASOCIACION DESTINOS EUSKADI,Plan anual Destinos Euskadi 2016,"11.979,00 €",2016
326,UNIVERSIDAD DEL PAIS VASCO / EUSKAL HERRIKO UNIBERTSITATEA,Intervenciones artísticas UPV-Facultad Bellas Artes en Bilbao Art District,"2.100,00 €",2016
327,"UNIVERSIDAD DEL PAIS VASCO / EUSKAL HERRIKO UNIBERTSITATEA - MUSEO MARITIMO RÍA DE BILBAO - AURTENETXEA CONTAINERS, SA","Intervenciones artísticas UPV, Containers Aurtenextxea y Museo Marítimo Bilbao Art District","1.500,00 €",2016
328,AYUNTAMIENTO DE BILBAO (ÁREA EUSKERA Y EDUCACIÓN),Normalización uso del euskera en el comercio,"30.000,00 €",2016
329,AYUNTAMIENTO DE BILBAO (ÁREA DE OBRAS Y SERVICIOS),Colaboración con el Área de Obras y Servicios,-,2016
330,"EUSKO TRENBIDEAK - FERROCARRILES VASCOS, SA",Viajes tranvía BICB,-,2016
331,"SOCIEDAD PUBLICA DE GESTIÓN AMBIENTAL, IHOBE, SA",Colaboración para la celebración de la 8a Conferencia Europea de Ciudades y Pueblos Sostenibles (ICEI),"36.000,00 €",2016
332,UNIVERSIDAD DE LA IGLESIA DE DEUSTO,Promoción Economía productiva Bilbao Next Lab 2016-2018,"600.000,00 €",2016
333,ASOCIACIÓN DE APOYO AL DESARROLLO EMPRESARIAL DEMA-ENPRESA GARAPENA DE BARAKALDO,Programa Taldeka-Equipos de Emprendimiento,-,2016
334,AJEDREZ BILBAO E4,Grand Slam Ajedrez y Open Internacional Villa de Bilbao,"200.000,00 €",2016
335,"NUEVO MICRO BANK, SAU",Colaboración financiación emprendedores,-,2016
336,SERVICIO DE PREVENCIÓN MANCOMUNADO DE LAS ENTIDADES MUNICIPALES DE BILBAO,Actualización de las evaluaciones de riesgo en el ámbito municipal,-,2016
337,"CLUB DEPORTIVO BASKET BILBAO BERRI, SAD",Cesión del Bilbao Arena,-,2016
338,CONSORCIO DE TRANSPORTES DE BIZKAIA,Tarjetas Barik Build 2016,Coste según tarifas oficiales,2016
339,FUNDACIÓN SOLIDARTERS.COM,Fair Saturday 2016,"25.000,00 €",2016
340,UNIVERSIDAD DE LA IGLESIA DE DEUSTO,Technoshop 2016,"30.000,00 €",2016
341,FUNDACION ADSIS,Eurocip VII,-,2016
342,ESCUELA PROFESIONAL DE OTXARKOAGA,Eurocip VII,-,2016
343,"PEÑASCAL, S.COOP.",Eurocip VII,-,2016
344,"BASQUETOUR TURISMOAREN EUSKAL AGENTZIA AGENCIA VASCA DE TURISMO, SA",Acciones año 2016,"10.000,00 €",2016
345,UNIVERSIDAD DE LA IGLESIA DE DEUSTO,Tursimo Urbano 2016/2017,-,2016
346,"DIPUTACIÓN FORAL DE BIZKAIA - BASQUETOUR TURISMOAREN EUSKAL AGENTZIA AGENCIA VASCA DE TURISMO, SA",Routes Europe 2018,"333.333,00 €",2016
347,"MIK, S.COOP.",Análisis y desarrollo del sector de Servicios Avanzados en Bilbao,-,2016
348,ERABERRIKUNTZA ETA EZAGUTZAN ADITUAK DIREN PERTSONEN MUGIKORTASUNA SUSTATZEKO ELKARTEA - BIZKAIA TALENT,Dual Career,-,2016
349,UNIVERSIDAD DEL PAIS VASCO / EUSKAL HERRIKO UNIBERTSITATEA,Plan Emprende,"25.000,00 €",2016
350,ASOCIACIÓN CENTRO DE INNOVACIÓN DE BILBAO-CIB,Bilbao Berrikuntza Garage,-,2016
